,upc_no,upc_desc,category_no_level_1,category_desc_level_1,category_no_level_2,category_desc_level_2
1201,0082676614038,GRDH PINEAPPLE CHUNKS,40802,FRESH KITCHENS PINEAPPLE,408,FRESH KITCHENS FRUIT
1202,0082676614042,GRDH PINEAPPLE CORED,40802,FRESH KITCHENS PINEAPPLE,408,FRESH KITCHENS FRUIT
1203,0004470000063,OSCM WIENERS,57502,HOT DOGS - BASE MEAT,575,HOT DOGS
1204,0004450005021,KAHN MEAT HOT DOGS 10 CT,57502,HOT DOGS - BASE MEAT,575,HOT DOGS
1205,0001590000209,BARS BUN LENGTH FRANKS,57502,HOT DOGS - BASE MEAT,575,HOT DOGS
1206,0005450019327,BALL PARK BUN SZ FRANKS,57502,HOT DOGS - BASE MEAT,575,HOT DOGS
1207,0007010001644,JMRL BUN LNGTH HOT DOGS,57502,HOT DOGS - BASE MEAT,575,HOT DOGS
1208,0001590000211,BARS JUMBO MEAT FRANKS,57502,HOT DOGS - BASE MEAT,575,HOT DOGS
1209,0007010001637,JHN MRL FRANKS,57502,HOT DOGS - BASE MEAT,575,HOT DOGS
1210,0004470000210,OSCM JUMBO WIENERS,57502,HOT DOGS - BASE MEAT,575,HOT DOGS
1211,0001590013401,BARS AM WIENERS,57502,HOT DOGS - BASE MEAT,575,HOT DOGS
1212,0005450019352,BLPK FRANKS 8CT,57502,HOT DOGS - BASE MEAT,575,HOT DOGS
1213,0001111096677,HTGF WIENERS,57502,HOT DOGS - BASE MEAT,575,HOT DOGS
1214,0004450009452,KAHN BUN SIZE FRANKS,57502,HOT DOGS - BASE MEAT,575,HOT DOGS
1215,0001111070205,KRO LEMON JUICE,12032,LEMON JUICE & LIME JUICE (50% OVER JUICE),007,SHELF STABLE JUICE
1216,0074189012390,LAROSA PIZZA SAUCE,27442,PIZZA MIX DRY,128,PIZZA SAUCE/CRUST/MIX
1217,0001111001317,BFG CRRT CK 6IN,40410,CAKES: LAYERS,404,CAKES
1218,0001111001532,BFG VANILLA CLBRTN 6IN CK,40410,CAKES: LAYERS,404,CAKES
1219,0001111007343,BKRY PNT BTTR CKY 16CT,40610,COOKIES: REGULAR,406,COOKIES
1220,0001111018102,BFG M&M MINI COOKIE 36CT,40610,COOKIES: REGULAR,406,COOKIES
1221,0001111007344,BKRY SUGAR CKY 16CT,40610,COOKIES: REGULAR,406,COOKIES
1222,0001111007342,BKRY OATML RSN CKY 16CT,40610,COOKIES: REGULAR,406,COOKIES
1223,0001111006258,BKRY CHOC CHIP MINI 36CT,40610,COOKIES: REGULAR,406,COOKIES
1224,0001111007100,BFG M&M COOKIES 16CT,40610,COOKIES: REGULAR,406,COOKIES
1225,0001111007341,BKRY CHO CHP CKY 16CT,40610,COOKIES: REGULAR,406,COOKIES
1226,0023858830000,SLMN ATL FLT FR CA RW EFY,42916,SALMON FR VALUE ADDED,429,SEAFOOD - SALMON-FARM RAISED
1227,0000000003121,PEPPERS ORANGE HOLLAND,98077,PEPPERS OTHER BELL,615,PEPPERS
1228,0001111091116,PEPPER BELL TRI-COLOR RPC,98077,PEPPERS OTHER BELL,615,PEPPERS
1229,0007265540509,HLTHCH STM BBQ STK W/RDPT,10002,FZ SS PREM NUTRITIONAL MEALS,039,FRZN SS PREMIUM MEALS
1230,0007265500110,HLTHCH STM BEEF TERIYAKI,10002,FZ SS PREM NUTRITIONAL MEALS,039,FRZN SS PREMIUM MEALS
1231,0007265540581,HLTHCH STM RAV CHKN MRNRA,10002,FZ SS PREM NUTRITIONAL MEALS,039,FRZN SS PREMIUM MEALS
1232,0007265545442,HLTHCH STM CHK FETT ALFRD,10002,FZ SS PREM NUTRITIONAL MEALS,039,FRZN SS PREMIUM MEALS
1233,0007265500102,HLTHCH STM BEEF MERLOT,10002,FZ SS PREM NUTRITIONAL MEALS,039,FRZN SS PREMIUM MEALS
1234,0007265545441,HLTHCH STM SWT & SOUR CKN,10002,FZ SS PREM NUTRITIONAL MEALS,039,FRZN SS PREMIUM MEALS
1235,0007020053005,MARZ CREAM CHSE FRUIT DIP,59409,DIPS FRUIT,594,DRESSINGS/DIPS
1236,0001111090032,PRSL NAVELS HEIRLOOM,98013,ORANGES NAVELS ALL,602,CITRUS
1237,0000000004012,NAVELS CHILEAN,98013,ORANGES NAVELS ALL,602,CITRUS
1238,0000000003107,ORANGES NAVEL MED,98013,ORANGES NAVELS ALL,602,CITRUS
1239,0001111018199,KRO NAVELS BAG,98013,ORANGES NAVELS ALL,602,CITRUS
1240,0003338314621,NAVELS AUSTRALIA FNCY NET,98013,ORANGES NAVELS ALL,602,CITRUS
1241,0004800135450,HLMN REAL MAYO SQUEEZE,21219,MAYONNAISE&WHIPPED DRESSING,089,SALAD DRESING&SANDWICH SPREADS
1242,0001111001988,KRO MAYONNAISE,21219,MAYONNAISE&WHIPPED DRESSING,089,SALAD DRESING&SANDWICH SPREADS
1243,0001111085110,KRO SQUEEZE MAYONNAISE,21219,MAYONNAISE&WHIPPED DRESSING,089,SALAD DRESING&SANDWICH SPREADS
1244,0002100002650,KRFT MRCL WHP LT DRESSING,21219,MAYONNAISE&WHIPPED DRESSING,089,SALAD DRESING&SANDWICH SPREADS
1245,0004800121348,HLMN REAL MAYONNAISE,21219,MAYONNAISE&WHIPPED DRESSING,089,SALAD DRESING&SANDWICH SPREADS
1246,0002100002632,KRFT REAL MAYONNAISE,21219,MAYONNAISE&WHIPPED DRESSING,089,SALAD DRESING&SANDWICH SPREADS
1247,0004800135366,HLMN REAL MAYO SQUEEZE,21219,MAYONNAISE&WHIPPED DRESSING,089,SALAD DRESING&SANDWICH SPREADS
1248,0002100002675,KRFT MRCL WHP SQUEEZE,21219,MAYONNAISE&WHIPPED DRESSING,089,SALAD DRESING&SANDWICH SPREADS
1249,0002100002649,KRFT MRCL WHP DRESSING,21219,MAYONNAISE&WHIPPED DRESSING,089,SALAD DRESING&SANDWICH SPREADS
1250,0002840017251,CRACKERJACK,24297,SALTY SNACKS W/SWEETENER 2.5OZ OR LARGER,158,SS/VENDING - SALTY SNACKS
1251,0022571700000,PRSL ANGUS ROAST BEEF,45140,MEAT: BEEF BULK,451,DELI MEAT: BULK
1252,0022594100000,PRSL CHC ROAST BEEF WELL,45140,MEAT: BEEF BULK,451,DELI MEAT: BULK
1253,0007680000691,LNDR PLAIN BAGELS 6CT,51442,REFRIGERATED BAGELS/MUFFINS,072,BAGELS&CREAM CHEESE
1254,0007373108304,MSSN TORTILLA ROUNDS,24290,TORTILLA CHIPS,055,BAG SNACKS
1255,0078113871012,ONBRDR TORTILLA CHIPS,24290,TORTILLA CHIPS,055,BAG SNACKS
1256,0002840006405,TOSTITO BITE SIZE ROUNDS,24290,TORTILLA CHIPS,055,BAG SNACKS
1257,0002840000210,SANTTS WHT CORN TRT TRNGL,24290,TORTILLA CHIPS,055,BAG SNACKS
1258,0001111079183,KRO TORTILLA STRIPS,24290,TORTILLA CHIPS,055,BAG SNACKS
1259,0002840008314,TOSTITO SCOOPS TORTLA CHP,24290,TORTILLA CHIPS,055,BAG SNACKS
1260,0001111009114,KRO REST STYL WHT TORTLLA,24290,TORTILLA CHIPS,055,BAG SNACKS
1261,0002840011688,TOSTITO CTNA THN CRSP CHP,24290,TORTILLA CHIPS,055,BAG SNACKS
1262,0002840006408,TOSTITO SCOOPS TRTL CHIPS,24290,TORTILLA CHIPS,055,BAG SNACKS
1263,0001111080712,KRO TORTILLA CUPZ,24290,TORTILLA CHIPS,055,BAG SNACKS
1264,0001111010164,KRO TRAD TORTILLA CHIPS,24290,TORTILLA CHIPS,055,BAG SNACKS
1265,0001111010159,KRO TRAD YLW RND TORTILLA,24290,TORTILLA CHIPS,055,BAG SNACKS
1266,0002840003633,TOSTITO MULTIGRAIN SCOOPS,24290,TORTILLA CHIPS,055,BAG SNACKS
1267,0002840006399,TOSTITO REST STYLE CHIPS,24290,TORTILLA CHIPS,055,BAG SNACKS
1268,0002840008313,TOSTITO REST STYLE CHIPS,24290,TORTILLA CHIPS,055,BAG SNACKS
1269,0007373108103,MSSN TORTILLA STRIPS,24290,TORTILLA CHIPS,055,BAG SNACKS
1270,0005113157634,SCOTCH\MAGIC TAPE,85153,TAPE & MAILING PRODUCTS,815,HOME AND OFFICE
1271,0001111004415,KRO EXTR VIRGIN OLIVE OIL,03003,EXTRA VIRGIN OLIVE OIL,030,OLIVE OIL
1272,0001111004412,KRO EXTRA VRGN OLIVE OIL,03003,EXTRA VIRGIN OLIVE OIL,030,OLIVE OIL
1273,0001111004417,KRO EXTRA VRGN OLIVE OIL,03003,EXTRA VIRGIN OLIVE OIL,030,OLIVE OIL
1274,0004172914372,SKYLN CHILI 3 WAY,03701,CHILI,037,FROZEN HANDHELDS & SNACKS
1275,0072457500003,GSTR CHILI & SPAGHETTI,03701,CHILI,037,FROZEN HANDHELDS & SNACKS
1276,0004300002826,KL AID JMRS CHERRY 10PK,12048,ASEPTIC PACK JUICE AND DRINKS (UNDER 50% JUICE),119,ASEPTIC JUICE
1277,0008768400099,CPRI SN STRWBRY KIWI 10PK,12048,ASEPTIC PACK JUICE AND DRINKS (UNDER 50% JUICE),119,ASEPTIC JUICE
1278,0004300002825,KL AID JMRS TRP PNCH 10PK,12048,ASEPTIC PACK JUICE AND DRINKS (UNDER 50% JUICE),119,ASEPTIC JUICE
1279,0008768400095,CPRI SN PACIFIC CLR 10PK,12048,ASEPTIC PACK JUICE AND DRINKS (UNDER 50% JUICE),119,ASEPTIC JUICE
1280,0004300002822,KL AID JMRS BLU RASP 10PK,12048,ASEPTIC PACK JUICE AND DRINKS (UNDER 50% JUICE),119,ASEPTIC JUICE
1281,0008768400107,CPRI SN FRUIT PUNCH 10PK,12048,ASEPTIC PACK JUICE AND DRINKS (UNDER 50% JUICE),119,ASEPTIC JUICE
1282,0004300002828,KL AID JMRS GRAPE 10PK,12048,ASEPTIC PACK JUICE AND DRINKS (UNDER 50% JUICE),119,ASEPTIC JUICE
1283,0008768400100,CPRI SN WILD CHERRY 10PK,12048,ASEPTIC PACK JUICE AND DRINKS (UNDER 50% JUICE),119,ASEPTIC JUICE
1284,0004300002827,KL AID JMRS KW STRAW 10PK,12048,ASEPTIC PACK JUICE AND DRINKS (UNDER 50% JUICE),119,ASEPTIC JUICE
1285,0005200001035,GATORADE FRST ICY CHARGE,12050,ISOTONIC DRINKS SINGLE SERVE,010,ISOTONIC DRINKS
1286,0085817600205,BDYARMR SPRDRNK ORAN MNGO,12050,ISOTONIC DRINKS SINGLE SERVE,010,ISOTONIC DRINKS
1287,0005200032555,GATORADE COOL BLUE,12050,ISOTONIC DRINKS SINGLE SERVE,010,ISOTONIC DRINKS
1288,0085817600242,BDYARMR WTRMLN STRWBRY,12050,ISOTONIC DRINKS SINGLE SERVE,010,ISOTONIC DRINKS
1289,0085817600227,BDYARMR PEACH MANGO LYTE,12050,ISOTONIC DRINKS SINGLE SERVE,010,ISOTONIC DRINKS
1290,0005200004316,GATORADE GZ BERRY,12050,ISOTONIC DRINKS SINGLE SERVE,010,ISOTONIC DRINKS
1291,0004900004523,POWERADE GRAPE,12050,ISOTONIC DRINKS SINGLE SERVE,010,ISOTONIC DRINKS
1292,0005200033875,GATORADE FRUIT PUNCH,12050,ISOTONIC DRINKS SINGLE SERVE,010,ISOTONIC DRINKS
1293,0004900007776,POWERADE WHT CHERRY ZERO,12050,ISOTONIC DRINKS SINGLE SERVE,010,ISOTONIC DRINKS
1294,0005200032016,GATORADE GLACIER FREEZE,12050,ISOTONIC DRINKS SINGLE SERVE,010,ISOTONIC DRINKS
1295,0004900004579,POWERADE ORANGE,12050,ISOTONIC DRINKS SINGLE SERVE,010,ISOTONIC DRINKS
1296,0085817600217,BDYARMR SPRDRNK TROP CTRS,12050,ISOTONIC DRINKS SINGLE SERVE,010,ISOTONIC DRINKS
1297,0005200004325,GATORADE GZ GLCR FREEZE,12050,ISOTONIC DRINKS SINGLE SERVE,010,ISOTONIC DRINKS
1298,0005200032673,GATORADE FRCE GRAPE,12050,ISOTONIC DRINKS SINGLE SERVE,010,ISOTONIC DRINKS
1299,0004900005071,POWERADE ZERO GRAPE,12050,ISOTONIC DRINKS SINGLE SERVE,010,ISOTONIC DRINKS
1300,0004900004575,POWERADE MTN BERRY BLAST,12050,ISOTONIC DRINKS SINGLE SERVE,010,ISOTONIC DRINKS
1301,0005200010239,GATORADE GLACIER CHERRY,12050,ISOTONIC DRINKS SINGLE SERVE,010,ISOTONIC DRINKS
1302,0004900005436,POWERADE ZERO ORANGE,12050,ISOTONIC DRINKS SINGLE SERVE,010,ISOTONIC DRINKS
1303,0004900004573,POWERADE LEMON LIME,12050,ISOTONIC DRINKS SINGLE SERVE,010,ISOTONIC DRINKS
1304,0005200033876,GATORADE ORANGE,12050,ISOTONIC DRINKS SINGLE SERVE,010,ISOTONIC DRINKS
1305,0005200001038,GATORADE FRST ARCTC BLITZ,12050,ISOTONIC DRINKS SINGLE SERVE,010,ISOTONIC DRINKS
1306,0004900004574,POWERADE ION4 FRUIT PUNCH,12050,ISOTONIC DRINKS SINGLE SERVE,010,ISOTONIC DRINKS
1307,0005200004228,GATORADE G ZRO SGR ORANGE,12050,ISOTONIC DRINKS SINGLE SERVE,010,ISOTONIC DRINKS
1308,0005200004252,GATORADE G ZRO SGR GL CHR,12050,ISOTONIC DRINKS SINGLE SERVE,010,ISOTONIC DRINKS
1309,0004900007452,POWERADE BLUE RASP CHERRY,12050,ISOTONIC DRINKS SINGLE SERVE,010,ISOTONIC DRINKS
1310,0004900005034,POWERADE STRWBRY LEMONADE,12050,ISOTONIC DRINKS SINGLE SERVE,010,ISOTONIC DRINKS
1311,0005200033877,GATORADE LEMON LIME,12050,ISOTONIC DRINKS SINGLE SERVE,010,ISOTONIC DRINKS
1312,0085817600206,BDYARMR SPRDRNK STR BANAN,12050,ISOTONIC DRINKS SINGLE SERVE,010,ISOTONIC DRINKS
1313,0004900005456,POWERADE WHITE CHERRY,12050,ISOTONIC DRINKS SINGLE SERVE,010,ISOTONIC DRINKS
1314,0004900005072,POWERADE ZERO MIXED BERRY,12050,ISOTONIC DRINKS SINGLE SERVE,010,ISOTONIC DRINKS
1315,0005200013462,GATORADE STRWBRRY WATRMLN,12050,ISOTONIC DRINKS SINGLE SERVE,010,ISOTONIC DRINKS
1316,0004900005614,POWERADE ZERO FRUIT PUNCH,12050,ISOTONIC DRINKS SINGLE SERVE,010,ISOTONIC DRINKS
1317,0001111082224,KRO SLICED RIPE OLVS CN,20211,RIPE OLIVES,080,PICKLE/RELISH/PCKLD VEG&OLIVES
1318,0071575610022,DRIS BLACKBERRIES ORGNC,60405,BLACKBERRIES ORGANIC,604,BERRIES
1319,0005000084811,CFMT SGF FRNCH VNLLA CRMR,07901,REFRIG COFF CREAMER FF/SF,079,REFRIGERATED COFFEE CREAMERS
1320,0003760013872,SPAM CLASSIC,19275,LUNCHEON MEAT (SPAM),004,MEAT - SHELF STABLE
1321,0000930000674,MOLV KOSH DL SNDWCH STUFR,20213,PICKLES,080,PICKLE/RELISH/PCKLD VEG&OLIVES
1322,0001111089236,KRO KOSHER DILL SPEARS,20213,PICKLES,080,PICKLE/RELISH/PCKLD VEG&OLIVES
1323,0001111089312,KRO HAMBURGER DILL CHIPS,20213,PICKLES,080,PICKLE/RELISH/PCKLD VEG&OLIVES
1324,0000930000080,MOLV KOSHER DILL STRIPS,20213,PICKLES,080,PICKLE/RELISH/PCKLD VEG&OLIVES
1325,0005410000060,VLSC KOSHER DILL SPEARS,20213,PICKLES,080,PICKLE/RELISH/PCKLD VEG&OLIVES
1326,0001111089427,KRO FAST FOOD HAMB CHIPS,20213,PICKLES,080,PICKLE/RELISH/PCKLD VEG&OLIVES
1327,0001111091870,KRO RADISHES RED RPC,98168,RADISH,608,VEGETABLES SALAD
1328,0000000004089,RADISHES RED GREEN TOP,98168,RADISH,608,VEGETABLES SALAD
1329,0001111091649,KRO TENDER SPINACH,98148,SALAD SPINACH,640,SALAD MIX
1330,0007143000976,DOLE SPINACH,98148,SALAD SPINACH,640,SALAD MIX
1331,0007143000964,DOLE BABY SPINACH,98148,SALAD SPINACH,640,SALAD MIX
1332,0001111091050,KRO BABY SPINACH,98148,SALAD SPINACH,640,SALAD MIX
1333,0001111091049,KRO BABY SPINACH,98148,SALAD SPINACH,640,SALAD MIX
1334,0001111084592,KRO CUT YAMS IN SYRUP,02078,SWEET POTATOES,002,CAN VEGETABLES - SHELF STABLE
1335,0001760004386,BRCE CUT YAMS IN SYRUP,02078,SWEET POTATOES,002,CAN VEGETABLES - SHELF STABLE
1336,0089470001004,CHBN FOB STRWBRY GRK YGRT,34534,GREEK SS YOGURT,062,YOGURT
1337,0003663200835,DANN OIKOS TZ MX BRY YGRT,34534,GREEK SS YOGURT,062,YOGURT
1338,0089470001032,CHBN STRWB BANNA GRK YGRT,34534,GREEK SS YOGURT,062,YOGURT
1339,0003663203753,DANN L&F STRWB CHSCK YGRT,34534,GREEK SS YOGURT,062,YOGURT
1340,0003663200836,DANN OIKOS TZ STRWBR YGRT,34534,GREEK SS YOGURT,062,YOGURT
1341,0089470001001,CHBN NF PLAIN YOGURT,34534,GREEK SS YOGURT,062,YOGURT
1342,0081829001466,CHBN MIXED BERRY GRK YGRT,34534,GREEK SS YOGURT,062,YOGURT
1343,0089470001006,CHBN PEACH GREEK YOGURT,34534,GREEK SS YOGURT,062,YOGURT
1344,0001111050481,KRO FF GRK PLAIN YOGURT,34534,GREEK SS YOGURT,062,YOGURT
1345,0089470001012,CHBN RASPBERRY GREEK YGRT,34534,GREEK SS YOGURT,062,YOGURT
1346,0089470001005,CHBN BLUEBERRY GRK YOGURT,34534,GREEK SS YOGURT,062,YOGURT
1347,0001800000501,PLBRY CNNBN RL W/ICNG 8CT,51447,REFRIGERATED SPECIALTY ROLLS,066,REFRGRATED DOUGH PRODUCTS
1348,0001800000318,PLBRY CNNBN FLKY ROLL 8CT,51447,REFRIGERATED SPECIALTY ROLLS,066,REFRGRATED DOUGH PRODUCTS
1349,0001800000526,PLBRY CNNBN RL/ORN IC 8CT,51447,REFRIGERATED SPECIALTY ROLLS,066,REFRGRATED DOUGH PRODUCTS
1350,0001800000512,PLBRY CNNBN RL/CRM CH 8CT,51447,REFRIGERATED SPECIALTY ROLLS,066,REFRGRATED DOUGH PRODUCTS
1351,0001111090706,KRO CRM CHS CINN ROLL 8CT,51447,REFRIGERATED SPECIALTY ROLLS,066,REFRGRATED DOUGH PRODUCTS
1352,0001111089034,KRO CINN ROLLS W/ICNG 8CT,51447,REFRIGERATED SPECIALTY ROLLS,066,REFRGRATED DOUGH PRODUCTS
1353,0021077500000,HTGF CHICKEN WINGS VP,53004,CHICKEN WINGS,530,CHICKEN FRESH
1354,0088831391490,NTHN BTB BEEF FRANKS,57504,HOT DOGS - PREMIUM,575,HOT DOGS
1355,0088831391499,NTHN SKNLS BEEF FRANKS,57504,HOT DOGS - PREMIUM,575,HOT DOGS
1356,0001111084009,KRO DICED GREEN CHILIES,02051,MEXICAN PEPPERS CHILIES,093,TRADITIONAL MEXICAN FOODS
1357,0001111084542,KRO DCD JALAPENO PEPPERS,02051,MEXICAN PEPPERS CHILIES,093,TRADITIONAL MEXICAN FOODS
1358,0003700040212,TIDE ORIG SCNT HE DETRGNT,37715,LIQUID LAUNDRY DETERGENTS,104,LAUNDRY DETERGENTS
1359,0003700040217,TIDE ORIGINAL SCENT HE LD,37715,LIQUID LAUNDRY DETERGENTS,104,LAUNDRY DETERGENTS
1360,0003320009330,AHMR CLN BURST LNDRY DTRG,37715,LIQUID LAUNDRY DETERGENTS,104,LAUNDRY DETERGENTS
1361,0003700097305,DAWN ULTRA DISHWASH LQD,37716,LIQUID DISH DETERGENT,103,DISHWASH DETERGENTS
1362,0003700097291,DAWN PLTNM RAIN DSHWSH,37716,LIQUID DISH DETERGENT,103,DISHWASH DETERGENTS
1363,0003700039713,DAWN ULTRA DISHWASH LQD,37716,LIQUID DISH DETERGENT,103,DISHWASH DETERGENTS
1364,0003700097056,DAWN ULTRA DISHWASH LQD,37716,LIQUID DISH DETERGENT,103,DISHWASH DETERGENTS
1365,0003500045041,PLMV OXY DISH LIQUID,37716,LIQUID DISH DETERGENT,103,DISHWASH DETERGENTS
1366,0024733780000,DELI SUMMER SLAW,46355,VEG/GRAIN/PASTA SALADS,463,COLD MEAL SOLUTIONS - BULK
1367,0021220300000,PRSL BF ANG TNDRLN STEAK,50003,ANGUS BEEF,500,BEEF:LOINS
1368,0021218200000,PRSL BF ANG TOP SRLN STK,50003,ANGUS BEEF,500,BEEF:LOINS
1369,0021222640000,PRSL BF ANG T LN ST BL 2P,50003,ANGUS BEEF,500,BEEF:LOINS
1370,0021212300000,PRSL BF ANG SIRLN STK PTT,50003,ANGUS BEEF,500,BEEF:LOINS
1371,0021220340000,PRSL BF ANG TNDRLN STEAK,50003,ANGUS BEEF,500,BEEF:LOINS
1372,0000000094664,TOMATOES RED OTV ORGNC,61704,TOMATOES RED OTV ORGANIC,617,TOMATOES
1373,0000000004042,PLUMS RED PP RPC,98080,PLUMS,605,STONE FRUIT
1374,0000000004040,PLUMS BLACK VF RPC,98080,PLUMS,605,STONE FRUIT
1375,0002370001415,TYSN NAE POPCORN CHKN,10035,BONELESS SNACK/18OZ AND LARGER,059,FRZN PREPARED CHICKEN
1376,0002370001405,TYSN ANYTZR BFFLO BNL WNG,10035,BONELESS SNACK/18OZ AND LARGER,059,FRZN PREPARED CHICKEN
1377,0002370001493,TYSN ANYTZR H BBQ BNL WNG,10035,BONELESS SNACK/18OZ AND LARGER,059,FRZN PREPARED CHICKEN
1378,0023558490000,KAHN DELUXE CLUB BOLOGNA,45120,BOLOGNA/LOAVES/FRANKS/BACON,451,DELI MEAT: BULK
1379,0001111091686,KRO TOMATOES GRAPE RD RPC,98092,TOMATOES FIELD SNACKING,617,TOMATOES
1380,0075166677005,TOM NTSW CHERUB CLMSH RPC,98092,TOMATOES FIELD SNACKING,617,TOMATOES
1381,0000000020722,ICE CRUSHED CUBED,10199,ICE - CRUSHED/CUBED,045,FROZEN ICE
1382,0007330920022,HMCTY ICE NUGGETS 22LB,10199,ICE - CRUSHED/CUBED,045,FROZEN ICE
1383,0000000020707,ICE CRUSHED CUBED,10199,ICE - CRUSHED/CUBED,045,FROZEN ICE
1384,0007330920007,HMCTY ICE NUGGETS 7LB,10199,ICE - CRUSHED/CUBED,045,FROZEN ICE
1385,0007084701247,MONSTER ENERGY ZERO ULTRA,18240,ENERGY DRINK - SINGLE SERVE,131,ENERGY DRINKS
1386,0007084781116,MONSTER ENERGY,18240,ENERGY DRINK - SINGLE SERVE,131,ENERGY DRINKS
1387,0061126981899,RED BULL ENERGY DRINK,18240,ENERGY DRINK - SINGLE SERVE,131,ENERGY DRINKS
1388,0004000000160,SKITTLES,23261,MISC CHECKLANE CANDY,201,CANDY - CHECKLANE
1389,0007343500225,KGHW SVRY BTR ROLLS 4PK,40115,ROLLS: DINNER,401,ROLLS
1390,0007343500006,KGHW HAWAIN DELI ROLL 4PK,40115,ROLLS: DINNER,401,ROLLS
1391,0007343500230,KGHW HAWAIIAN ROLLS 24CT,40115,ROLLS: DINNER,401,ROLLS
1392,0007343500201,KGHW SVRY BTR DNR RL 12CT,40115,ROLLS: DINNER,401,ROLLS
1393,0007343500004,KGHW HAWAIIAN ROLLS 12CT,40115,ROLLS: DINNER,401,ROLLS
1394,0001111057613,KRO STWBY PRM FRT BR 6CT,49420,ADULT PREMIUM,071,FROZEN NOVELTIES-WATER ICE
1395,0001111082377,KRO ROLLED PIE CRUST 2CT,51451,REFRIGERATED PIE CRUST,066,REFRGRATED DOUGH PRODUCTS
1396,0001800028794,PLBRY RLLD PIE CRUSTS 2CT,51451,REFRIGERATED PIE CRUST,066,REFRGRATED DOUGH PRODUCTS
1397,0000000004662,FRDA SHALLOTS BOXED,98669,ONIONS GOURMET,619,ONIONS
1398,0001111085634,KRO PURE CANOLA OIL,53222,CANOLA OILS,019,SHORTENING & OIL
1399,0002700069086,WESSON CANOLA OIL,53222,CANOLA OILS,019,SHORTENING & OIL
1400,0001111085632,KRO PURE CANOLA OIL,53222,CANOLA OILS,019,SHORTENING & OIL
1401,0000000004258,CHERRIES RAINIER,98041,CHERRIES RANIER,605,STONE FRUIT
1402,0003940001970,BUSH MPL CRD BCN BKD BEAN,02046,PREPARED BEANS - BAKED W/PORK /VEGETARIAN,003,CAN BEANS
1403,0003940001977,BUSH BR SGR HCKRY BKD BNS,02046,PREPARED BEANS - BAKED W/PORK /VEGETARIAN,003,CAN BEANS
1404,0003940001614,BUSH ORIGINAL BAKED BEANS,02046,PREPARED BEANS - BAKED W/PORK /VEGETARIAN,003,CAN BEANS
1405,0003940001972,BUSH CNTRY STYL BKD BEANS,02046,PREPARED BEANS - BAKED W/PORK /VEGETARIAN,003,CAN BEANS
1406,0003940001612,BUSH ORIGINAL BAKED BEANS,02046,PREPARED BEANS - BAKED W/PORK /VEGETARIAN,003,CAN BEANS
1407,0003940001594,BUSH HOMESTYL BAKED BEANS,02046,PREPARED BEANS - BAKED W/PORK /VEGETARIAN,003,CAN BEANS
1408,0003940001635,BUSH VEGETARN BAKED BEANS,02046,PREPARED BEANS - BAKED W/PORK /VEGETARIAN,003,CAN BEANS
1409,0005200001122,VCMP PORK AND BEANS,02046,PREPARED BEANS - BAKED W/PORK /VEGETARIAN,003,CAN BEANS
1410,0003940001910,BUSH GRLLN BRBN BRSGR BNS,02046,PREPARED BEANS - BAKED W/PORK /VEGETARIAN,003,CAN BEANS
1411,0003940001974,BUSH CNTRY STYL BKD BEANS,02046,PREPARED BEANS - BAKED W/PORK /VEGETARIAN,003,CAN BEANS
1412,0001111087586,KRO TATER ROUNDS,10197,FRZN TATER TOTS/OTHER EXTRUDED,041,FROZEN POTATOES
1413,0001312000133,OIDA CRISPY CROWNS,10197,FRZN TATER TOTS/OTHER EXTRUDED,041,FROZEN POTATOES
1414,0001111087577,KRO TATER BITES,10197,FRZN TATER TOTS/OTHER EXTRUDED,041,FROZEN POTATOES
1415,0001312000026,OIDA MINI TATER TOTS,10197,FRZN TATER TOTS/OTHER EXTRUDED,041,FROZEN POTATOES
1416,0001312000082,OIDA TATER TOTS,10197,FRZN TATER TOTS/OTHER EXTRUDED,041,FROZEN POTATOES
1417,0004400002829,NBSC BLVTA BLBRY BSC 5CT,18320,WELLNESS/PORTION CONTROL,053,COOKIES
1418,0004400003195,NBSC BLVTA CIN BRNSGR 5CT,18320,WELLNESS/PORTION CONTROL,053,COOKIES
1419,0001300079800,HEINZ HMSTYL BEEF GRAVY,19305,GRAVY CAN/GLASS,083,DRY SAUCE/GRAVY
1420,0001300079820,HEINZ HMSTYL CHICKEN GRVY,19305,GRAVY CAN/GLASS,083,DRY SAUCE/GRAVY
1421,0001300079910,HEINZ HMSTYL TURKEY GRAVY,19305,GRAVY CAN/GLASS,083,DRY SAUCE/GRAVY
1422,0003800013860,PRNGL SALT VINEGAR,24296,CANISTER SNACKS,058,WAREHOUSE SNACKS
1423,0003800013857,PRNGL CHEDDAR CHEESE,24296,CANISTER SNACKS,058,WAREHOUSE SNACKS
1424,0003800016966,PRNGL ORIGINAL MEGA CAN,24296,CANISTER SNACKS,058,WAREHOUSE SNACKS
1425,0002840005509,LAYS STAX ORIGINAL,24296,CANISTER SNACKS,058,WAREHOUSE SNACKS
1426,0003800016968,PRNGL SOUR CRM&ONION MEGA,24296,CANISTER SNACKS,058,WAREHOUSE SNACKS
1427,0002840005515,LAYS STAX SR CRM ONION,24296,CANISTER SNACKS,058,WAREHOUSE SNACKS
1428,0003800013841,PRNGL ORIGINAL,24296,CANISTER SNACKS,058,WAREHOUSE SNACKS
1429,0003800013843,PRNGL SOUR CREAM ONION,24296,CANISTER SNACKS,058,WAREHOUSE SNACKS
1430,0003800017591,PRNGL CHDDR MEGA CAN,24296,CANISTER SNACKS,058,WAREHOUSE SNACKS
1431,0003800018371,PRNGL BBQ,24296,CANISTER SNACKS,058,WAREHOUSE SNACKS
1432,0002100001714,KRFT MOZZ STRING CHS 12CT,35541,STRING CHEESE,065,CHEESE
1433,0001111058728,KRO COLBY JACK SNACK PACK,35541,STRING CHEESE,065,CHEESE
1434,0001111058152,KRO STRING CHEESE 12CT,35541,STRING CHEESE,065,CHEESE
1435,0001111088639,KRO CLBY JACK CHS STK 12C,35541,STRING CHEESE,065,CHEESE
1436,0001111050333,KRO COLBY JACK CHS CUBES,35541,STRING CHEESE,065,CHEESE
1437,0001111058151,KRO STRING CHEESE 24CT,35541,STRING CHEESE,065,CHEESE
1438,0001111082677,KRO LT STRING CHEESE,35541,STRING CHEESE,065,CHEESE
1439,0003010000133,ZESTA ORIG SALTINE CRACKR,43405,SALTINE/OYSTER,054,CRACKERS & MISC BAKED FOOD
1440,0001111003429,CRNCH CHRON SALTINE CRCKR,43405,SALTINE/OYSTER,054,CRACKERS & MISC BAKED FOOD
1441,0001111001979,KRO OYSTER CRACKERS,43405,SALTINE/OYSTER,054,CRACKERS & MISC BAKED FOOD
1442,0005354490900,SKYLN CHILI OYSTR CRACKRS,43405,SALTINE/OYSTER,054,CRACKERS & MISC BAKED FOOD
1443,0004400000057,NBSC PREM SALTNE CRACKERS,43405,SALTINE/OYSTER,054,CRACKERS & MISC BAKED FOOD
1444,0004400002477,NBSC SOUP & OYSTER CRKRS,43405,SALTINE/OYSTER,054,CRACKERS & MISC BAKED FOOD
1445,0001111003779,CRNCH CHRON OYSTER CRCKR,43405,SALTINE/OYSTER,054,CRACKERS & MISC BAKED FOOD
1446,0001111009090,KRO SALTINE CRACKERS,43405,SALTINE/OYSTER,054,CRACKERS & MISC BAKED FOOD
1447,0000000004036,NECTARINES PP,98056,NECTARINES YELLOW FLESH,605,STONE FRUIT
1448,0001111086062,STO BLUE TORTILLA CHIPS,98476,TORTILLA CHIPS,672,NF SNACK
1449,0001111086005,STO YELLOW TORTILLA CHIPS,98476,TORTILLA CHIPS,672,NF SNACK
1450,0003600048754,HUGG SMPLY CLN SCNTD WPES,03100,SOFT PACKS,031,BABY WIPES
1451,0003600048750,HUGG SMPLY CLN DSNY FF WP,03100,SOFT PACKS,031,BABY WIPES
1452,0003600050407,HUGG ONE & DONE DSNY WPES,03100,SOFT PACKS,031,BABY WIPES
1453,0004126000668,CMFRTS FF BABY WIPES,03100,SOFT PACKS,031,BABY WIPES
1454,0003600031803,HUGG NAT CARE FF WIPES,03100,SOFT PACKS,031,BABY WIPES
1455,0003666906148,CKPF HOMESTYLE MEATBALLS,10057,FZ MEATBALLS,116,FRZN MULTI SERVE
1456,0003666906312,CKPF ITALIAN MEATBALLS,10057,FZ MEATBALLS,116,FRZN MULTI SERVE
1457,0001111090320,KRO ITALIAN MEATBALLS,10057,FZ MEATBALLS,116,FRZN MULTI SERVE
1458,0000000004093,ONIONS YELLOW MEDIUM,98142,ONIONS YELLOW (BULK&BAG),619,ONIONS
1459,0001111091682,KRO ONIONS YELLOW,98142,ONIONS YELLOW (BULK&BAG),619,ONIONS
1460,0000000004508,ONIONS YELLOW SETS BULK,98142,ONIONS YELLOW (BULK&BAG),619,ONIONS
1461,0001111087422,KRO CLASSIC GARLIC BREAD,10028,FRZN GARLIC BREAD,044,FROZEN BREAD/DOUGH
1462,0007045900930,NWYK GARLIC KNOTS 6CT,10028,FRZN GARLIC BREAD,044,FROZEN BREAD/DOUGH
1463,0089505900061,BARLLA LASAGNE,30471,NOODLES DRY,084,DRY NOODLES & PASTA
1464,0001111085128,KRO MEDIUM EGG NOODLES,30471,NOODLES DRY,084,DRY NOODLES & PASTA
1465,0001111085126,KRO XTRA WIDE EGG NOODLES,30471,NOODLES DRY,084,DRY NOODLES & PASTA
1466,0001111081344,KRO OVEN READY LASAGNA,30471,NOODLES DRY,084,DRY NOODLES & PASTA
1467,0001111085127,KRO WIDE EGG NOODLES,30471,NOODLES DRY,084,DRY NOODLES & PASTA
1468,0007680851558,BARLLA LASAGNE,30471,NOODLES DRY,084,DRY NOODLES & PASTA
1469,0083418300712,ALXF SWT POTATO JULIENNE,69504,NF FRZN SWEET POTATOES,695,NF FZ POTATOES
1470,0002200001788,WRGLY EXTRA POLAR ICE MGA,23229,CHEWING GUM,201,CANDY - CHECKLANE
1471,0002200001787,WRGLY EXTRA SPRMNT MEGA,23229,CHEWING GUM,201,CANDY - CHECKLANE
1472,0002200000838,WRGLY EXTRA SWT WTRMLN GM,23229,CHEWING GUM,201,CANDY - CHECKLANE
1473,0001254601107,TRDNT SPEARMINT GUM,23229,CHEWING GUM,201,CANDY - CHECKLANE
1474,0001254601109,TRDNT ORIGINAL GUM,23229,CHEWING GUM,201,CANDY - CHECKLANE
1475,0002200000899,WRGLY EXTRA SPEARMINT GUM,23229,CHEWING GUM,201,CANDY - CHECKLANE
1476,0002200000891,WRGLY EXTRA PEPPERMNT GUM,23229,CHEWING GUM,201,CANDY - CHECKLANE
1477,0002200000898,WRGLY EXTRA POLAR ICE GUM,23229,CHEWING GUM,201,CANDY - CHECKLANE
1478,0001820053168,BUD LIGHT 24PK CAN,27001,DOMESTIC BELOW PREMIUM SMALL 3-10 PK,270,DOMESTIC BELOW PREMIUM
1479,0001200016116,LFWTR BOTTLED WATER,03504,PREMIUM WATER,035,WATER
1480,0003450063202,LOL TRAD HALF & HALF,18296,HALF & HALF,060,FLUID MILK PRODUCTS
1481,0001111050266,KRO HALF & HALF,18296,HALF & HALF,060,FLUID MILK PRODUCTS
1482,0001111050268,KRO HALF & HALF,18296,HALF & HALF,060,FLUID MILK PRODUCTS
1483,0001111091661,STO LETTUCE ROM HT OR RPC,60805,VARIETY LETTUCE ORGANIC,608,VEGETABLES SALAD
1484,0001111001812,STO BASIL,61404,HERBS ORGANIC PACKAGED,614,HERBS/GARLIC
1485,0001111000876,STO BASIL,61404,HERBS ORGANIC PACKAGED,614,HERBS/GARLIC
1486,0004400003338,NBSC CHIPS AHOY FAMILY SZ,45413,TRAY PACK/CHOC CHIP COOKIES,053,COOKIES
1487,0003010054086,KBLR SFT BATCH CHOC CHIP,45413,TRAY PACK/CHOC CHIP COOKIES,053,COOKIES
1488,0003010010026,KBLR SANDIES PECAN SHRTBD,45413,TRAY PACK/CHOC CHIP COOKIES,053,COOKIES
1489,0001111001589,KRO CHEWY CHIPMATES CKYS,45413,TRAY PACK/CHOC CHIP COOKIES,053,COOKIES
1490,0004400003221,NBSC CHIPS AHOY CHNK CHIP,45413,TRAY PACK/CHOC CHIP COOKIES,053,COOKIES
1491,0004400003219,NBSC CHIPS AHOY COOKIES,45413,TRAY PACK/CHOC CHIP COOKIES,053,COOKIES
1492,0004400002991,NBSC CHIPS AHOY CHW REESE,45413,TRAY PACK/CHOC CHIP COOKIES,053,COOKIES
